{
  "expxmedia_template": 1,
  "template_id": "apresentacao-padrao-4c7e2a",
  "titulo": "Deck animado com moldura, cartões e diagrama",
  "tipo": "apresentacao",
  "motor": "html",
  "formato": "16:9",
  "canvas": { "w": 1920, "h": 1080 },
  "status": "validado",
  "criado_em": "2026-09-25T10:00:00-03:00",
  "atualizado_em": "2026-09-25T10:00:00-03:00",

  "estilos": ["tipografico", "dados", "diagrama", "animado"],
  "serve_para": ["aula", "palestra", "comparacao", "processo", "numero-e-dado"],

  "versoes": { "motor": "0.1.0", "remotion": null },
  "dependencias": {},

  "requisitos": [],
  "exige_porta_voz": false,

  "tokens": ["fundo", "fundo_alt", "texto", "texto_inverso", "apoio", "destaque", "destaque_2"],
  "fontes": ["titulo", "texto"],

  "sequencia": ["titulo", "declaracao", "grade", "comparacao", "etapas", "estatisticas", "fluxo", "screenshot", "cta"],
  "kinds": {
    "titulo": {
      "midia": "imagem",
      "duracao_s": null,
      "fit": null,
      "requisitos": [],
      "slots": {
        "kicker":    { "tipo": "texto", "max": 4,  "obrigatorio": false, "nota": "palavras: linha curta acima do título, em caixa alta" },
        "titulo":    { "tipo": "texto", "max": 10, "obrigatorio": true,  "nota": "palavras; <b>palavra</b> vira destaque; o tamanho encolhe até a palavra mais longa caber" },
        "subtitulo": { "tipo": "texto", "max": 20, "obrigatorio": true,  "nota": "palavras" }
      }
    },
    "declaracao": {
      "midia": "imagem",
      "duracao_s": null,
      "fit": null,
      "requisitos": [],
      "slots": {
        "texto": { "tipo": "texto", "max": 20, "obrigatorio": true,  "nota": "palavras; a tese em uma frase; <b>palavra</b> vira destaque" },
        "autor": { "tipo": "texto", "max": 4,  "obrigatorio": false, "nota": "palavras" }
      }
    },
    "grade": {
      "midia": "imagem",
      "duracao_s": null,
      "fit": null,
      "requisitos": [],
      "slots": {
        "titulo": { "tipo": "texto", "max": 8, "obrigatorio": true, "nota": "palavras" },
        "itens":  { "tipo": "lista", "obrigatorio": true, "nota": "3 a 6 cartões {titulo até 5 palavras, texto até 14}; até 4 lado a lado, senão 3 colunas" }
      }
    },
    "comparacao": {
      "midia": "imagem",
      "duracao_s": null,
      "fit": null,
      "requisitos": [],
      "slots": {
        "titulo":   { "tipo": "texto", "max": 8, "obrigatorio": true, "nota": "palavras" },
        "esquerda": { "tipo": "lista", "obrigatorio": true, "nota": "o lado apagado: {titulo até 4 palavras, itens 1 a 5 de até 8 palavras}" },
        "direita":  { "tipo": "lista", "obrigatorio": true, "nota": "o lado em destaque, mesmo formato" }
      }
    },
    "etapas": {
      "midia": "imagem",
      "duracao_s": null,
      "fit": null,
      "requisitos": [],
      "slots": {
        "titulo": { "tipo": "texto", "max": 8, "obrigatorio": true, "nota": "palavras" },
        "itens":  { "tipo": "lista", "obrigatorio": true, "nota": "3 a 5 passos {titulo até 4 palavras, texto até 10}; com 4 ou mais ficam lado a lado" }
      }
    },
    "estatisticas": {
      "midia": "imagem",
      "duracao_s": null,
      "fit": null,
      "requisitos": [],
      "slots": {
        "titulo":  { "tipo": "texto", "max": 8, "obrigatorio": true, "nota": "palavras" },
        "numeros": { "tipo": "lista", "obrigatorio": true, "nota": "1 a 4 números {valor, sufixo, rotulo até 4 palavras, fonte externa obrigatória}" }
      }
    },
    "fluxo": {
      "midia": "imagem",
      "duracao_s": null,
      "fit": null,
      "requisitos": [],
      "slots": {
        "titulo": { "tipo": "texto", "max": 8, "obrigatorio": true, "nota": "palavras" },
        "nos":    { "tipo": "lista", "obrigatorio": true, "nota": "3 a 6 nós {titulo até 4 palavras, texto até 8 ou null}; até 4 numa linha, senão duas" }
      }
    },
    "screenshot": {
      "midia": "imagem",
      "duracao_s": null,
      "fit": null,
      "requisitos": [],
      "slots": {
        "titulo":  { "tipo": "texto", "max": 6,  "obrigatorio": true, "nota": "palavras" },
        "legenda": { "tipo": "texto", "max": 12, "obrigatorio": true, "nota": "palavras; sem imagem, a legenda ocupa a moldura" },
        "imagem":  { "tipo": "asset", "asset": "captura", "obrigatorio": false, "nota": "arquivo da pasta de ativos da peça" }
      }
    },
    "cta": {
      "midia": "imagem",
      "duracao_s": null,
      "fit": null,
      "requisitos": [],
      "slots": {
        "titulo": { "tipo": "texto", "max": 10, "obrigatorio": false, "nota": "palavras; vazio usa o cta.padrao da Alma" },
        "texto":  { "tipo": "texto", "max": 16, "obrigatorio": false, "nota": "palavras" },
        "url":    { "tipo": "texto", "max": 200, "obrigatorio": false, "nota": "vazio usa o cta.destino da Alma" },
        "imagem": { "tipo": "asset", "asset": "captura", "obrigatorio": false, "nota": "arquivo da pasta de ativos da peça; vazio mostra o nome da empresa e o destino" }
      }
    }
  },

  "assets": [],

  "validacao": {
    "contraste_min": 3.0,
    "fonte_min_px": 18,
    "resultado": "aprovado",
    "validado_em": "2026-09-25T10:00:00-03:00",
    "achados": []
  },

  "origem": { "tipo": "criado", "id_compartilhado": null, "inspiracao": null },

  "compartilhamento": { "estado": "nao_enviado", "enviado_em": null, "pr_url": null, "erro": null }
}
